reflective, radiation, assembly, focused, member, focus, receive, converge, reflect, angle, portion, alternate, opaque, support, critical, reflected, position, redirect, away, 22a, 22b, second, strike, incident, reflector, refraction, elevation, direct, film, isometric, upper, pass, impinge, reflectively, index, adhesive, fourth, accordingly, plurality, layer, reflection, apart, 24a, couple, bond, internal, discuss, relative, transparent, opposite, converged, neighboring, facet, adjacent, 52a, 50a, 22i, proximate, acrylic, pyramidal, affix, backing, incoming, equation, total, substantially, surface, therefrom, enlarged, sharply, comprises:a, likelihood, t, figs., path, curved, element, 73a, contoured, metallic, extend, accurately, intermediate, approach, shape, t1, debris, relevant, dimensional, electrically, 24b, diagonal, 20a, convex, sided, central, 70a, 28a, view, plan, space, axis, strip, rigid, orient, great, diselinide, cole, 13d, 22c, redirected, 22d, 73b, subelements, inaccuracy, concave, tracking, concentrically, region, edge, medium, inverted, conductive, approximately, staggered, circular, partially, left, lens, similar, reduce, respectively, module, 50b, triangular, elements, illustration, fashion, previously, track, cost, distance, 64a, adhesively, hexagonal, coupling, face, generate, collect, concentration, bead, downwardly, d, substitute, normal, unit, flat, electrical, millimeter, clarity, angular, price, cheap, geometric, flex, manner, purpose, direction, trace, collectively, spherical, accordance, current, directly, calculation, therebetween, dust, neighbor, mold, drawback, equal, thickness, separate, address, telluride, elongate, handle, dual, permit, advantageous, require, electricity, material, continuous, compare, refractive, shadow, alternative, u.s., thereof, attach, respective, construe, pat., right, exemplary, solve, act, unobstructed, reffaction, tan(1/2, indentation, glance, jr., =1/2(90-a, refine, redfield, decal, coevaporation, d=2t/tan(90, subelement, stephens, slop, bendable, shepard, fossilfuel, 21)))(3, halve, redirects, tan(90, canted, competitively, incidental, 22f, 22e, movement, machine, orientation, longitudinal, interface, fifth, single, construction, photovoltaic, efficiency, cadmium, mechanism, dirt, shipment, 72a, hydroelectric, amick, intermittent, stagger, 56a, spacing, join, include, correspond, specific, flexible, recognize, advantage, forth, overall, half, schematically, 58a, consistently, resilient, conversely, diagonally, 70d, obscure, bulky, mitchell, deliberately, different, typically, disclose, collection, identical, eliminate, foregoing, broaden, 70b, 70c, inefficient, thorough, bending, upwardly, visible, continue, similarly, 52b, 13c, dash, harmful, closer, combustion, group, furthermore, minimum, respect, select, embodiment, etc., bonding, t2, fossil, share, 13a, ax, composite, block, incidentally, date, 13b, integrally, entirety, slope, pas, alternately, nonuniform, center, location, no., inherent, versa, deviate, vice, low, sun, relationship, ray, absorb, additional, wafer, range, elongated, saving, despite, parasitic, potentially, efficiently, internally, interference, somewhat, contaminant, fuel, cast, column, associated, method, indium, semiconductor, row, account, unfortunately, effectiveness, regular, corner, number, common, protect, potential, tab, installation, unlike, day, operate, gap, electric, pattern, silicon, instead, expensive, understanding, sixth, offset, serve, glass, reference, parallel, sufficient, far, actually, individually, industry, therethrough, groove, embed, starting, sheet, mount, area, arsenide, skilled, easily, teaching, beneath, restrict, twice, integral, copper, optical, size, adequate, nearly, concentrate, site, mirror, convert, aspect, utilize, desirable, apparatus, dependent, lay, interconnection, technical, series, need, value, characteristic, arrange, difficult, width, device, solder, disadvantage, demonstrate, assume, large, reach, prevent, remain, sandwich, embody, boundary, numerous, refer, separation, secure, comprises, greatly, good, level, known, structural, necessarily, amorphous, end, connection, inexpensive, adhere, g, immediately, entirely, volume, form, capability, undesirable, tend, gallium, determine, crystal, specification, following, instance, extremely, thereto, choose, grid, scope, non, contact, surround, fig., develop, illustrative, adjust, accomplish, array, external, manufacturing, conversion, wire, fix, technology, presence, incorporate, point, like, necessary, represent, replace, associate, disclosure, typical, completely, alternatively, sputter, power, problem, uniform, wide, highly, relatively, create, equivalent, sunlight, set, difference, simultaneously, plate, capable, vacuum, arrangement, practice, standard, limit, term, significant, composition, panel, fabricate, increase, mean, patent, achieve, time, pair, small, degree, e.g., avoid, follow, beam, and/or, generation, technique, add, -, manufacture, subject, component, produce, know, desire, step, depend, substrate, operation, general, application, property, line, coat, long, employ, change, allow, vapor, chemical, remove, preferably, energy, modification, base, function, detailed, present, source, light, deposition, define, circuit, possible, process, cross, art, cause, connect, improve, case, order, particular, particularly, object, claims, use, contain, apply, conventional, structure, high, example, result, relate, preferred, field, provide, brief, summary, background, drawing, cell, solar, comprise, claim, invention, description,,,,,,,,,,,,,,,,,,,,,,,,,,,,,,,,,,,,,,,,,,,,,,,,,,,,,,,,,,,,,,,,,,,,,,,,,,,,,,,,,,,,,,,,,,,,,,,,,,,,,,,,,,,,,,,,,,,,,,,,,,,,,,,,,,,,,,,,,,,,,,,,,,,,,,,,,,,,,,,,,,,,,,,,,,,,,,,,,,,,,,,,,,,,,,,,,,,,,,,,,,,,,,,,,,,,,,,,,,,,,,,,,,,,,,,,,,,,,,,,,,,,,,,,,,,,,,,,,,,,,,,,,,,,,,,,,,,,,,,,,,,,,,,,,,,,,,,,,,,,,,,,,,,,,,,,,,,,,,,,,,,,,,,,,,,,,,,,,,,,,,,,,,,,,,,,,,,,,,,,,,,,,,,,,,,,,,,,,,,,,,,,,,,,,,,,,,,,,,,,,,,,,,,,,,,,,,,,,,,,,,,,,,,,,,,,,,,,,,,,,,,,,,,,,,,,,,,,,,,,,,,,,,,,,,,,,,,,,,,,,,,,,,,,,,,,,,,,,,,,,,,,,,,,,,,,,,,,,,,,,,,,,,,,,,,,,,,,,,,,,,,,,,,,,,,,,,,,,,,,,,,,,,,,,,,,,,,,,,,,,,,,,,,,,,,,,,,,,,,,,,,,,,,,,,,,,,,,,,,,,,,,,,,,,,,,,,,,,,,,,,,,,,,,,,,,,,,,,,,,,,,,,,,,,,,,,,,,,,,,,,,,,,,,,,,,,,,,,,,,,,,,,,,,,,,,,,,,,,,,,,,,,,,,,,,,,,,,,,,,,,,,,,,,,,,,,,,,,,,,,,,,,,,,,,,,,,,,,,,,,,,,,,,,,,,,,,,,,,,,,,,,,,,,,,,,,,,,,,,,,,,,,,,,,,,,,,,,,,,,,,,,,,,,,,,,,,,,,,,,,,,,,,,,,,,,,,,,,,,,,,,,,,,,,,,,,,,,,,,,,,,,,,,,,,,,,,,,,,,,,,,,,,,,,,,,,,,,,,,,,,,,,,,,,,,,,,,,,,,,,,,,,,,,,,,,,,,,,,,,,,,,,,,,,,,,,,,,,,,,,,,,,,,,,,,,,,,,,,,,,,,,,,,,,,,,,,,,,,,,,,,,,,,,,,,,,,,,,,,,,,,,,,,,,,,,,,,,,,,,,,,,,,,,,,,,,,,,,,,,,,,,,,,,,,,,,,,,,,,,,,,,,,,,,,,,,,
slide, module, member, filler, electrically, connection, terminal, block, resin, reinforce, outputting, conductive, lubricant, sealing, roof, protective, building, roofing, numeral, bypass, excel, enclose, silicone, seal, bent, automobile, tubular, desirably, taking, sheet, box, connector, copolymer, bend, electrode, cable, polyethylene, forego, material, insulate, tape, hollow, outside, grease, steel, schematic, ethylene, foil, pet, fix, solder, sliding, face, polytrifluoroethylene, upper, wire, flexible, film, tetrafluoroethylene, eva, recess, portion, tube, diode, corrugated, fluororesin, vinylacetate, end, configuration, flexibility, integral, pair, copper, instal, corrugate, bonding, polyvinyl, wiring, shrinkage, freely, body, opposite, polyetherimide, polyphenyl, meshing, naphthalate, crack, mean, exterior, curvature, view, connect, curved, fluoride, trademark, slant, expose, line, appearance, nylon, reliable, coated, dispose, terephthalate, double, envelope, endurance, embed, ribbon, interpose, 1207b, trephthalate, ferrous, cover, radius, situate, stacked, mm, prepare, resultant, sandwich, treatment, lead, predetermined, configure, power, envelop, figs., soft," ""s", lay, adhesive, evaluation, protrude, plurality, output, shape, like, making, pont, thermocompression, explanatory, laminate, roll, reference, instance, metallic, oil, m, electric, du, sectional, externally, sn, accord, cross, case, document, group, humidity, constitution, arrange, sulfide, neutral, suffer, optionally, vinyl, plastic, insulating, highly, h, consist, hanging, ordinarily, c./85%, crosswise, 1207a, chloroprene, eaves, suffers, market, f, bond, press, peel, laminator, plan, cu, indicate, polyimide, mesh, company, rubber, primer, variously, polyethyleneterephthalate, protruded, clearance, ridge, external, ni, e, extend, serve, improved, polycarbonate, resistant, property, conduct, protect, characterize, distinguishable, tile, folding, pronounced, or/and, sealed, remain, photoelectric, flat, japanese, chloride, work, color, hold, chip, corona, galvanize, select, ag, possible, negative, machine, demand, g, perforate, tefzel, rh, positive, d, ordinary, situation, usable, coat, illustrate, compose, constitute, insulation, interior, separately, readily, magnet, deform, etfe, stack, polymer, resistance, black, plat, adjacent, environmental, interval, cracking, relevant, weave, position, free, sequentially, fiber, length, diameter, compress, housing, stress, heat, design, similarly, desire, way, virtue, weather, b, metal, maintain, engage, roller, hardly, extension, appropriate, constituent, soldering, prevent, non, c, durability, installation, fuse, optically, atmosphere, alloy, width, bear, corrosion, cycle, core, hour, foregoing, zinc, compound, dip, polyester, conversion, realize, series, polybutyleneterephthalate, no.302924/1995, noryl, abs, c./85%rh, polyphenylene, changes, weathering, walling, genarating, daido, extendedly, mm1.5, entrap, galfan, butadiene, hatch, 11(b, lubricity, acrylonitrile, excecution, 10(b, 10(a, environments, rafter, 12(a, mfg, timacolor, burning, cell(,751, ppo, polyarylate, al, tin, ultraviolet, satisfy, vicinity, subject, deteriorate, gl, pvc, door, spacedly, engineer, corrugation, waterproofing, polyacetal, unavoidably, fluororesins, crosslinked, apparatus, adhesion, preparation, correspond, specific, damage, force, word, epoxy, strength, physical, modify, later, enable, styrene, clip, pvf, insulated, protrusion, foreign, pp, damp, smoothly, limitative, orient, inner, likely, reliability, low, inside, directly, hot, particularly, properly,-40, counterpart, beginning, flame, unexamined, polyurethane, bending, propylene, thickness, manner, obtain, crystalline, stainless, hardness, fig, covered, workability, columnar, unsaturated, phenol, produce, electrical, problematic, bubble, care, structured, co., ltd., leak, hinder, establish, following, test, movable, correlate, alternately, entirety, repetition, variety, generate, function, affect, scratch, extra, compatibility, butyral, viscosity, tedlar, dust, repeatedly, thermoplastic, polyamide, environment, separate, reasonable, outdoors, problem, adjust, integrate, deformation, impact, selenide, board, die, occur, facilitate, semiconductor, example, processing, treat, partially, occurrence, inorganic, tool, polypropylene, joint, instrument, link, converter, production, necessary, pressure, efficient, original, previously, prevention, slow, severe, order, weight, good, recently, examine, absorber, uv, reason, follow, yield, natural, connected, resist, integration, addition, plate, capable, restrict, isolate, promote, improve, place, arrangement, microcrystalline, moisture, capacity, evacuate, acetate, single, apply, formation," """, inventor, type, desirable, join, publication, r, superior, protection, wave, window, special, sufficiently, difficult, insert, surface, conventional, believe, matter, clearly, repeat, aluminum, prior, fig., consideration, wall, withstand, central, generation, propose, 8), comprises, simply, evaluate, corresponding, titanium, amorphous, section, commercial, atmospheric, contrast, minute, tend, expect, determine, define, composite, hereinafter, silicon, use, thereto, center, c., load, rear, state, usually, figure, ray, ensure, small, glass, condition, structure, advantage, contact, procedure, limitation, curve, purpose, room, mechanism, illustrative, electricity, substantially, stage, indium, cause, area, respect, requirement, respectively, ceramic, common, thereof, suitable, alternatively, process, thereon, polycrystalline, eliminate, layer, object, present, introduce, conductivity, explain, equal, air, silver, collect, difference, mention, easily, vacuum, water, interface, different, finally, patent, temperature, accordance, substrate, m., apparent, combination, mechanical, coating, absorb, density, refer, direction, performance, observe, i.e., include, form, step, depend, embodiments, complete, parallel, sufficient, second, require, contain, size, employ, long, method, change, understand, base, art, relatively, similar, light, oxide, disclose, achieve, provide, cost, increase, know, claims, relate, limit, high, preferably, embodiment, result, preferred, field, brief, background, summary, drawing, cell, solar, comprise, claim, invention, description,,,,,,,,,,,,,,,,,,,,,,,,,,,,,,,,,,,,,,,,,,,,,,,,,,,,,,,,,,,,,,,,,,,,,,,,,,,,,,,,,,,,,,,,,,,,,,,,,,,,,,,,,,,,,,,,,,,,,,,,,,,,,,,,,,,,,,,,,,,,,,,,,,,,,,,,,,,,,,,,,,,,,,,,,,,,,,,,,,,,,,,,,,,,,,,,,,,,,,,,,,,,,,,,,,,,,,,,,,,,,,,,,,,,,,,,,,,,,,,,,,,,,,,,,,,,,,,,,,,,,,,,,,,,,,,,,,,,,,,,,,,,,,,,,,,,,,,,,,,,,,,,,,,,,,,,,,,,,,,,,,,,,,,,,,,,,,,,,,,,,,,,,,,,,,,,,,,,,,,,,,,,,,,,,,,,,,,,,,,,,,,,,,,,,,,,,,,,,,,,,,,,,,,,,,,,,,,,,,,,,,,,,,,,,,,,,,,,,,,,,,,,,,,,,,,,,,,,,,,,,,,,,,,,,,,,,,,,,,,,,,,,,,,,,,,,,,,,,,,,,,,,,,,,,,,,,,,,,,,,,,,,,,,,,,,,,,,,,,,,,,,,,,,,,,,,,,,,,,,,,,,,,,,,,,,,,,,,,,,,,,,,,,,,,,,,,,,,,,,,,,,,,,,,,,,,,,,,,,,,,,,,,,,,,,,,,,,,,,,,,,,,,,,,,,,,,,,,,,,,,,,,,,,,,,,,,,,,,,,,,,,,,,,,,,,,,,,,,,,,,,,,,,,,,,,,,,,,,,,,,,,,,,,,,,,,,,,,,,,,,,,,,,,,,,,,,,,,,,,,,,,,,,,,,,,,,,,,,,,,,,,,,,,,,,,,,,,,,,,,,,,,,,,,,,,,,,,,,,,,,,,,,,,,,,,,,,,,,,,,,,,,,,,,,,,,,,,,,,,,,,,,,,,,,,,,,,,,,,,,,,,,,,,,,,,,,,,,,,,,,,,,,,,,,,,,,,,,,,,,,,,,,,,,,,,,,,,,,,,,,,,,,,,,,,,,,,,,,,,,,,,,,,,,,,,,,,,,,,,,,,,,,,,,,,,,,,,,,,,,,,,,,,,,,,,,,,,,,,,,,,,,,,,,,,,,,,,,,,,,,,,,,,,,,,,,,,,,
bypass, output, unit, diode, synthesize, characteristic, illumination, battery, detection, module, photoelectric, energize, calculate, measuring, divide, inverse, supply, measure, illuminate, block, n-1, shield, detect, subtract, area, voltage, conversion, parallel, element, operation, compact, terminal, entire, measured, datum, control, disabled, point, current, light, m2, power, measurement, connect, a3, a2, series, drop, calculated, mean, scale, capacity, apparatus, sum, total, device, individual, value, digital, obtain, fifth, setting, a1, exist, fourth, calculation, constitute, needless, a5, a4, a6, actually, store, change, number, influence, hardware, indicate, component, simulator, accurately, plurality, respective, n, nm, expose, a7, program, large, special, portion, perform, obtained, correspondence, state, non, size, receive, reason, hand, outdoor, course, prepared, consist, completely, absence, subject, relatively, cost, rom, a/d, b3, stepwise, disk, include, small, manner, c3, information, correspond, m, arrangement, enable, amplifier, unevenly, c1, b4, b1, source, stably, preliminarily, ninth, object, circuit, appropriately, simultaneously, equipment, twice, storage, second, capacitor, eighth, utilize, relation, method, isc, seventh, d2, versa, vice, note, like, selectively, c2, input, b2, uniformly, division, add, set, resistor, n2, simplify, sixth, likewise, hereinafter, especially, remain, individually, divided, microcomputer, ram, subtracting, serial/parallel, energized, magnetooptical, amplify, pio, arithmetic, basis, furthermore, load, signal, cope, floppy, dl, sweep, kw/m2, cpu, widely, step, recognize, space, need, variation, short, conventional, associate, 2n, season, stored, sky, b5, specifically, require, identical, eliminate, bipolar, hall, printer, d3, illuminated, reverse, explain, sunlight, i.e., cloth, equivalently, subsequently, refer, single, convert, vary, respectively, chart, approximate, xenon, continuously, case, carefully, promising, dependence, base, know, open, e.g., elongated, am1.5, weather, check, spectrum, external, generation, exemplify, comprising, strongly, global, constant, alternatively, varied, determine, emission, monocrystalline, realize, similarly, equivalent, reduce, spectral, satisfy, sensor, advance, independently, consider, diagram, lamp, embodiment, wind, hard, accordance, pre, normally, concern, voc, therefrom, assume, thereof, remove, direction, transmit, bias, distribution, display, schematic, exposure, strong, commonly, following, extremely, recent, achieve, construct, clean, use, predetermined, consequently, process, shape, apply, environment, intensity, efficiently, array, force, requirement, sample, common, lower, combine, time, expensive, desire, polycrystalline, surface, negative, equal, al, difference, positive, mention, present, pair, condition, combination, select, preferably, silicon, accord, available, reference, compare, observe, amorphous, accompanying, effective, connection, -, photovoltaic, low, electric, embodiments, structure, directly, opposite, prefer, electron, type, substantially, order, modification, cover, detailed, fig., place, flow, figs., possible, scope, effect, addition, preferred, generate, particularly, range, problem, claims, semiconductor, limit, high, energy, example, provide, relate, material, follow, art, field, brief, background, result, drawing, summary, solar, cell, invention, comprise, description, claim,,,,,,,,,,,,,,,,,,,,,,,,,,,,,,,,,,,,,,,,,,,,,,,,,,,,,,,,,,,,,,,,,,,,,,,,,,,,,,,,,,,,,,,,,,,,,,,,,,,,,,,,,,,,,,,,,,,,,,,,,,,,,,,,,,,,,,,,,,,,,,,,,,,,,,,,,,,,,,,,,,,,,,,,,,,,,,,,,,,,,,,,,,,,,,,,,,,,,,,,,,,,,,,,,,,,,,,,,,,,,,,,,,,,,,,,,,,,,,,,,,,,,,,,,,,,,,,,,,,,,,,,,,,,,,,,,,,,,,,,,,,,,,,,,,,,,,,,,,,,,,,,,,,,,,,,,,,,,,,,,,,,,,,,,,,,,,,,,,,,,,,,,,,,,,,,,,,,,,,,,,,,,,,,,,,,,,,,,,,,,,,,,,,,,,,,,,,,,,,,,,,,,,,,,,,,,,,,,,,,,,,,,,,,,,,,,,,,,,,,,,,,,,,,,,,,,,,,,,,,,,,,,,,,,,,,,,,,,,,,,,,,,,,,,,,,,,,,,,,,,,,,,,,,,,,,,,,,,,,,,,,,,,,,,,,,,,,,,,,,,,,,,,,,,,,,,,,,,,,,,,,,,,,,,,,,,,,,,,,,,,,,,,,,,,,,,,,,,,,,,,,,,,,,,,,,,,,,,,,,,,,,,,,,,,,,,,,,,,,,,,,,,,,,,,,,,,,,,,,,,,,,,,,,,,,,,,,,,,,,,,,,,,,,,,,,,,,,,,,,,,,,,,,,,,,,,,,,,,,,,,,,,,,,,,,,,,,,,,,,,,,,,,,,,,,,,,,,,,,,,,,,,,,,,,,,,,,,,,,,,,,,,,,,,,,,,,,,,,,,,,,,,,,,,,,,,,,,,,,,,,,,,,,,,,,,,,,,,,,,,,,,,,,,,,,,,,,,,,,,,,,,,,,,,,,,,,,,,,,,,,,,,,,,,,,,,,,,,,,,,,,,,,,,,,,,,,,,,,,,,,,,,,,,,,,,,,,,,,,,,,,,,,,,,,,,,,,,,,,,,,,,,,,,,,,,,,,,,,,,,,,,,,,,,,,,,,,,,,,,,,,,,,,,,,,,,,,,,,,,,,,,,,,,,,,,,,,,,,,,,,,,,,,,,,,,,,,,,,,,,,,,,,,,,,,,,,,,,,,,,,,,,,,,,,,,,,,,,,,,,,,,,,,,,,,,,,,,,,,,,,,,,,,,,,,,,,,,,,,,,,,,,,,,,,,,,,,,,,,,,,,,,,,,,,,,,,,,,,,,,,,,,,,,,,,,,,,,,,,,,,,,,,,,,,,,,,,,,,,,,,,,,,,,,,,,,,,,,,,,,,,,,,,,,,,,,,,,,,,,,,,,,,,,,,,,,,,,,,,,,,,,,,,,,,,,,,,,,,,,,,,,,,,,,,,,,,,,,,,,,,,,,,,,,,,,,,,,,,,,,,,,,,,,,,,,,,,,,,,,
